{
  "package": "super-vector-db-connector",
  "licence": "AGPL-3.0",
  "useCase": "Connecting the core agent backend to local vector index instances",
  "distributionModel": "Client-Side SDK",
  "modifiedOrUnmodified": "modified",
  "linkedOrSeparateService": "linked",
  "attributionNeeded": true,
  "copyleftConcern": true,
  "approvalStatus": "Escalated"
}
